{
  "artifact_hashes": {
    "evidence_ledger.json": "0550cf9431d1925ab1e177048a5f2ba891d803a1a4d3feb5d80179db7bbd30b5",
    "failure_record": "6107e2969de4d337e603b6b0208e1671fab0d1247840db10088885873d097f2b",
    "supplied_evidence.json": "2d9da1643e77570f8eca74077fb8f108ca6e5b41be11cbfd5ffb6a3bdee858a2"
  },
  "assumptions": [],
  "created_at": "2026-07-28T12:56:53+00:00",
  "files": [
    "evidence_ledger.json",
    "supplied_evidence.json",
    "failure_record.json"
  ],
  "producer_version": "ASE_auto_build/0.9.2",
  "reproduction": {
    "error_code": "SchemaValidationError",
    "failed_stage": "spec_planning"
  },
  "request_id": "journal-smoke-003",
  "schema_version": "review-packet/v1",
  "source_backed_facts": [],
  "status": "failed",
  "structure_summary": {},
  "warnings": [
    "catalyst_spec.model.center must be boolean"
  ]
}
