{
  "artifact_hashes": {
    "evidence_ledger.json": "9ccf7e7a87b5ebd906eebd8c07b85131bdadb67b1e7793b56c45b5e9e817eff2",
    "failure_record": "c4310f84589c583093d622e77b4ed0d451762e158c6108e39dcc9732c039718e",
    "supplied_evidence.json": "9935660c532167c712e61c2fe9f944a330f1d0199909cf083f9dd79c64f206a8"
  },
  "assumptions": [],
  "created_at": "2026-07-30T18:15:26+00:00",
  "files": [
    "evidence_ledger.json",
    "supplied_evidence.json",
    "failure_record.json"
  ],
  "producer_version": "ASE_auto_build/0.9.2",
  "reproduction": {
    "error_code": "SchemaValidationError",
    "failed_stage": "spec_planning"
  },
  "request_id": "journal-agent-r1-smoke",
  "schema_version": "review-packet/v1",
  "source_backed_facts": [],
  "status": "failed",
  "structure_summary": {},
  "warnings": [
    "catalyst_spec missing required fields ['modifications']"
  ]
}
